{"definitionDigest":"bb777796c6d5b2b5739b07054ef3a869718211d4c030bdb39f03a4f7d04110d4","schemaVersion":1,"terminalStateDigest":"00958626001fc0db84da9145e7d654b51eba797f406aeab94ceb4d30237dc3fb","value":{"encoding":"portable-term-v1","node":{"args":[],"kind":"application","label":"done","symbolId":"490babcffda6b500f27f026ec11dd312956309446b5c4c348b7d44e5e3cc2fc5"},"sort":"GeneratedTopCell"}}