{
  "schemaVersion": 1,
  "terminalStateDigest": "15718bdffdfc2caffd43b17b81776086322e6f1ff64a8034cb7c32deac58c30c",
  "value": {
    "encoding": "portable-term-v1",
    "sort": "GeneratedTopCell",
    "node": {
      "kind": "token",
      "text": "bag14-done"
    }
  },
  "definitionDigest": "9e8dbb1183eafb016e9de893693987678359044ad0be2b4d2e132fe2f550da59"
}
